{
  "$schema": "https://json-schema.org/draft/2020-12/schema",
  "$id": "https://schemas.multicloud-network-mcp.dev/schemas/v1/interconnect-attachment.schema.json",
  "$comment": "GENERATED -- do not hand-edit. Produced by scripts/generate_schemas.py from multicloud_network_mcp.contracts.models.InterconnectAttachment (contract version 1.0.0). Edit the Pydantic model and re-run the script instead.",
  "$defs": {
    "CloudScope": {
      "description": "Where a fact was observed: which provider, which tenancy\nboundary, which geography, and when. Every field beyond ``provider``\nand ``collected_at`` is optional because no single provider\npopulates all of them -- see the field-by-field mapping below and\n``docs/normalization.md``.\n\n- ``tenant_id``: Azure AD tenant. Rarely meaningful for AWS/GCP.\n- ``account_id``: AWS account ID (12 digits).\n- ``subscription_id``: Azure subscription GUID.\n- ``project_id``: GCP project ID.\n- ``resource_group``: Azure resource group -- kept as its own field\n  (not folded into ``extensions``) because Azure resource identity is\n  genuinely incomplete without it, unlike a merely-supplementary fact.\n- ``region``: AWS/GCP-style region (``us-east-1``/``us-central1``).\n- ``location``: Azure's own term for the same granularity (ARM\n  responses literally use the JSON field name ``location``, not\n  ``region``) -- kept as a separate field rather than aliased onto\n  ``region``, since forcing Azure's ``location`` string into a field\n  named ``region`` would misrepresent which provider vocabulary it\n  came from.\n- ``zone``: availability-zone-level granularity, when the provider\n  exposes it (AWS AZ, Azure zone number, GCP zone).\n- ``collected_at``: ISO 8601 UTC timestamp this scope's data was\n  observed at -- never a live/real-time value.",
      "properties": {
        "provider": {
          "$ref": "#/$defs/Provider"
        },
        "tenant_id": {
          "anyOf": [
            {
              "type": "string"
            },
            {
              "type": "null"
            }
          ],
          "default": null,
          "title": "Tenant Id"
        },
        "account_id": {
          "anyOf": [
            {
              "type": "string"
            },
            {
              "type": "null"
            }
          ],
          "default": null,
          "title": "Account Id"
        },
        "subscription_id": {
          "anyOf": [
            {
              "type": "string"
            },
            {
              "type": "null"
            }
          ],
          "default": null,
          "title": "Subscription Id"
        },
        "project_id": {
          "anyOf": [
            {
              "type": "string"
            },
            {
              "type": "null"
            }
          ],
          "default": null,
          "title": "Project Id"
        },
        "resource_group": {
          "anyOf": [
            {
              "type": "string"
            },
            {
              "type": "null"
            }
          ],
          "default": null,
          "title": "Resource Group"
        },
        "region": {
          "anyOf": [
            {
              "type": "string"
            },
            {
              "type": "null"
            }
          ],
          "default": null,
          "title": "Region"
        },
        "location": {
          "anyOf": [
            {
              "type": "string"
            },
            {
              "type": "null"
            }
          ],
          "default": null,
          "title": "Location"
        },
        "zone": {
          "anyOf": [
            {
              "type": "string"
            },
            {
              "type": "null"
            }
          ],
          "default": null,
          "title": "Zone"
        },
        "collected_at": {
          "title": "Collected At",
          "type": "string"
        }
      },
      "required": [
        "provider",
        "collected_at"
      ],
      "title": "CloudScope",
      "type": "object"
    },
    "Provider": {
      "enum": [
        "aws",
        "azure",
        "gcp"
      ],
      "title": "Provider",
      "type": "string"
    }
  },
  "description": "Unifies an AWS Direct Connect ``VirtualInterface``, an Azure\n``ExpressRouteCircuitPeering``, and a GCP ``InterconnectAttachment``.\n\n``redacted: bool = True`` is a permanent guarantee, matching\n``Interconnect``: no per-attachment secret/key field exists here.\n\nSemantic gap: AWS Virtual Interfaces are explicitly typed (private/\ntransit/public VIF) with materially different routing behavior per\ntype, while Azure ExpressRoute circuit peerings (private/Microsoft\npeering) and GCP interconnect attachments (VLAN vs. partner) each\nhave their own, differently-shaped type taxonomies. This canonical\nmodel does not attempt a unified ``attachment_type`` field for that\nreason -- the type taxonomies don't correspond closely enough across\nproviders to avoid misrepresenting one provider's semantics in\nanother's vocabulary; each provider's own type string is preserved\nverbatim in ``extensions[provider]`` instead.",
  "properties": {
    "extensions": {
      "additionalProperties": {
        "additionalProperties": true,
        "type": "object"
      },
      "title": "Extensions",
      "type": "object"
    },
    "urn": {
      "title": "Urn",
      "type": "string"
    },
    "native_id": {
      "title": "Native Id",
      "type": "string"
    },
    "resource_type": {
      "title": "Resource Type",
      "type": "string"
    },
    "provider": {
      "$ref": "#/$defs/Provider"
    },
    "scope": {
      "$ref": "#/$defs/CloudScope"
    },
    "name": {
      "anyOf": [
        {
          "type": "string"
        },
        {
          "type": "null"
        }
      ],
      "default": null,
      "title": "Name"
    },
    "tags": {
      "additionalProperties": {
        "type": "string"
      },
      "title": "Tags",
      "type": "object"
    },
    "observed_at": {
      "title": "Observed At",
      "type": "string"
    },
    "source_api": {
      "anyOf": [
        {
          "type": "string"
        },
        {
          "type": "null"
        }
      ],
      "default": null,
      "title": "Source Api"
    },
    "collection_completeness": {
      "default": "complete",
      "title": "Collection Completeness",
      "type": "string"
    },
    "interconnect_urn": {
      "title": "Interconnect Urn",
      "type": "string"
    },
    "vlan_id": {
      "anyOf": [
        {
          "type": "integer"
        },
        {
          "type": "null"
        }
      ],
      "default": null,
      "title": "Vlan Id"
    },
    "asn": {
      "anyOf": [
        {
          "type": "integer"
        },
        {
          "type": "null"
        }
      ],
      "default": null,
      "title": "Asn"
    },
    "router_urn": {
      "anyOf": [
        {
          "type": "string"
        },
        {
          "type": "null"
        }
      ],
      "default": null,
      "title": "Router Urn"
    },
    "state": {
      "title": "State",
      "type": "string"
    },
    "redacted": {
      "default": true,
      "title": "Redacted",
      "type": "boolean"
    }
  },
  "required": [
    "urn",
    "native_id",
    "resource_type",
    "provider",
    "scope",
    "observed_at",
    "interconnect_urn",
    "state"
  ],
  "title": "InterconnectAttachment",
  "type": "object"
}
