{
  "extensions": {
    "azure": {
      "peering_type": "AzurePrivatePeering",
      "azure_asn": 12076,
      "primary_peer_address_prefix": "192.168.10.0/30",
      "secondary_peer_address_prefix": "192.168.10.4/30"
    }
  },
  "urn": "urn:mcnet:v1:azure:subscription_id=a1b2c3d4-5e6f-4a7b-8c9d-0e1f2a3b4c5d,location=eastus,resource_group=rg-networking:interconnect-attachment:/subscriptions/a1b2c3d4-5e6f-4a7b-8c9d-0e1f2a3b4c5d/resourceGroups/rg-networking/providers/Microsoft.Network/expressRouteCircuits/erc-partner-eastus/peerings/AzurePrivatePeering",
  "native_id": "/subscriptions/a1b2c3d4-5e6f-4a7b-8c9d-0e1f2a3b4c5d/resourceGroups/rg-networking/providers/Microsoft.Network/expressRouteCircuits/erc-partner-eastus/peerings/AzurePrivatePeering",
  "resource_type": "interconnect-attachment",
  "provider": "azure",
  "scope": {
    "provider": "azure",
    "tenant_id": null,
    "account_id": null,
    "subscription_id": "a1b2c3d4-5e6f-4a7b-8c9d-0e1f2a3b4c5d",
    "project_id": null,
    "resource_group": "rg-networking",
    "region": null,
    "location": "eastus",
    "zone": null,
    "collected_at": "2026-08-28T12:00:00Z"
  },
  "name": "AzurePrivatePeering",
  "tags": {},
  "observed_at": "2026-08-28T12:00:00Z",
  "source_api": "ExpressRouteCircuitPeeringsOperations.list",
  "collection_completeness": "complete",
  "interconnect_urn": "urn:mcnet:v1:azure:subscription_id=a1b2c3d4-5e6f-4a7b-8c9d-0e1f2a3b4c5d,location=eastus,resource_group=rg-networking:interconnect:/subscriptions/a1b2c3d4-5e6f-4a7b-8c9d-0e1f2a3b4c5d/resourceGroups/rg-networking/providers/Microsoft.Network/expressRouteCircuits/erc-partner-eastus",
  "vlan_id": 100,
  "asn": 65001,
  "router_urn": null,
  "state": "provisioned",
  "redacted": true
}
